{
  "batch": "011",
  "canonical_hash": "bbde3783d81c81a6d2627a94c58daa6d078db2a7e030e087bbfa0955e64438b2",
  "clues": 26,
  "created_at": "2026-09-19T20:22:45.381Z",
  "difficulty": {
    "band": 3,
    "max_search_depth": 0,
    "score": 408,
    "techniques": [
      "local_triples",
      "line_enumerate",
      "line_counts"
    ]
  },
  "family": "binairo",
  "family_version": 1,
  "generator_version": "1.0.0",
  "id": "bbde3783d81c81a6",
  "params": {
    "band_target": 3,
    "dig_passes": 6,
    "min_clues": 0,
    "size": 10,
    "symmetry": "diagonal"
  },
  "puzzle": ".0......1.1.....01.....1..0.11..11.1..........01.....0.......10.1......0..1...0.0.1....10...0.......",
  "seed": "011|098-binairo-b3-10x10-diagonal-50|32",
  "solution": "1010101010101010010101010100110011011010110010010110100101010101101010100110110001100101010101011010",
  "solver_version": "1.0.0",
  "uniqueness": {
    "method": "exhaustive-count-to-2",
    "nodes_searched": 1,
    "reference_checked": true,
    "verdict": "unique"
  }
}
