{
  "batch": "007",
  "canonical_hash": "2befdf687010536d221f64e4fcf585de2bf03ea16361df55fb1f16592496866e",
  "clues": 29,
  "created_at": "2026-09-19T17:39:34.955Z",
  "difficulty": {
    "band": 4,
    "max_search_depth": 0,
    "score": 236,
    "techniques": [
      "naked_single",
      "hidden_single",
      "locked_candidates_pointing",
      "hidden_pair",
      "w_wing",
      "locked_candidates_claiming",
      "xy_wing"
    ]
  },
  "family": "sudoku-classic",
  "family_version": 1,
  "generator_version": "1.0.0",
  "id": "2befdf687010536d",
  "params": {
    "band_target": 4,
    "box_h": 3,
    "box_w": 3,
    "dig_passes": 6,
    "min_clues": 17,
    "size": 9,
    "symmetry": "diagonal"
  },
  "puzzle": "85...9.6.71....4....3...........18.7....68..41..24..9..4.8..71.2....568....61...3",
  "seed": "007|070-sudoku-classic-b4-93x3-diagonal-60|242",
  "solution": "854179362719326458623584971462951837935768124187243596346892715271435689598617243",
  "solver_version": "1.0.0",
  "uniqueness": {
    "method": "exhaustive-count-to-2",
    "nodes_searched": 10,
    "reference_checked": true,
    "verdict": "unique"
  }
}
