{
  "batch": "011",
  "canonical_hash": "c783c8f64f94de7a337105dcf2f40f867d0f5df5acd4f572268adb9075e2d581",
  "clues": 22,
  "created_at": "2026-09-19T20:22:41.771Z",
  "difficulty": {
    "band": 2,
    "max_search_depth": 0,
    "score": 87,
    "techniques": [
      "local_triples",
      "line_counts"
    ]
  },
  "family": "binairo",
  "family_version": 1,
  "generator_version": "1.0.0",
  "id": "c783c8f64f94de7a",
  "params": {
    "band_target": 2,
    "dig_passes": 6,
    "min_clues": 0,
    "size": 8,
    "symmetry": "diagonal"
  },
  "puzzle": "...00.....0...01.0.00.0.1.1.0...0.01..1..........01.1..1.0....1.",
  "seed": "011|097-binairo-b2-8x8-diagonal-50|4",
  "solution": "0110011001011001101001011010011001011010010101011010100110011010",
  "solver_version": "1.0.0",
  "uniqueness": {
    "method": "exhaustive-count-to-2",
    "nodes_searched": 1,
    "reference_checked": true,
    "verdict": "unique"
  }
}
