{
  "batch": "004",
  "canonical_hash": "119ed53f44c6cd6aad0e6957550df5a583d878420b82167117e41a19d11354d1",
  "clues": 25,
  "created_at": "2026-09-19T17:08:19.161Z",
  "difficulty": {
    "band": 3,
    "max_search_depth": 0,
    "score": 84,
    "techniques": [
      "hidden_single",
      "naked_single",
      "locked_candidates_pointing",
      "hidden_triple",
      "hidden_pair"
    ]
  },
  "family": "sudoku-classic",
  "family_version": 1,
  "generator_version": "1.0.0",
  "id": "119ed53f44c6cd6a",
  "params": {
    "band_target": 3,
    "box_h": 3,
    "box_w": 3,
    "dig_passes": 6,
    "min_clues": 17,
    "size": 9,
    "symmetry": "none"
  },
  "puzzle": ".5....7...81.....4....2..13...2.3.......4.9.84..1...35...89..623.8..1..7.........",
  "seed": "004|017-sudoku-classic-b3-93x3-none-20|273",
  "solution": "253416789981357624764928513895273146132645978476189235517894362328561497649732851",
  "solver_version": "1.0.0",
  "uniqueness": {
    "method": "exhaustive-count-to-2",
    "nodes_searched": 15,
    "reference_checked": true,
    "verdict": "unique"
  }
}
