{
  "batch": "001",
  "canonical_hash": "6555980e8fbfb3fbf8d19b1968541ef471536439df036f70f0a66fada25aba56",
  "clues": 10,
  "created_at": "2026-09-19T15:56:17.941Z",
  "difficulty": {
    "band": 4,
    "max_search_depth": 0,
    "score": 82,
    "techniques": [
      "hidden_single",
      "locked_candidates_pointing",
      "naked_pair",
      "w_wing",
      "naked_single"
    ]
  },
  "family": "sudoku-classic",
  "family_version": 1,
  "generator_version": "1.0.0",
  "id": "6555980e8fbfb3fb",
  "params": {
    "band_target": 4,
    "box_h": 3,
    "box_w": 2,
    "dig_passes": 6,
    "min_clues": 8,
    "size": 6,
    "symmetry": "none"
  },
  "puzzle": "3.5........2.4.1......654.....6..3..",
  "seed": "001|005-sudoku-classic-b4-63x2-none-50|961",
  "solution": "365241514632243156132465426513651324",
  "solver_version": "1.0.0",
  "uniqueness": {
    "method": "exhaustive-count-to-2",
    "nodes_searched": 13,
    "reference_checked": true,
    "verdict": "unique"
  }
}
