{
  "batch": "001",
  "canonical_hash": "ceabe54bc0bb374034b6a0e86f111d1fc79c3cd901e7caa5d137e3fa2d80ca6d",
  "clues": 27,
  "created_at": "2026-09-19T15:56:13.067Z",
  "difficulty": {
    "band": 3,
    "max_search_depth": 0,
    "score": 66,
    "techniques": [
      "hidden_single",
      "naked_single",
      "x_wing"
    ]
  },
  "family": "sudoku-classic",
  "family_version": 1,
  "generator_version": "1.0.0",
  "id": "ceabe54bc0bb3740",
  "params": {
    "band_target": 3,
    "box_h": 3,
    "box_w": 3,
    "dig_passes": 6,
    "min_clues": 17,
    "size": 9,
    "symmetry": "diagonal"
  },
  "puzzle": "..2..4.....512....89.6......384...5..7...5.2.9...7...3......138...38.46......62..",
  "seed": "001|002-sudoku-classic-b3-93x3-diagonal-20|884",
  "solution": "362894571745123986891657342238461759176935824954278613627549138519382467483716295",
  "solver_version": "1.0.0",
  "uniqueness": {
    "method": "exhaustive-count-to-2",
    "nodes_searched": 11,
    "reference_checked": true,
    "verdict": "unique"
  }
}
