{
  "batch": "003",
  "canonical_hash": "9ec7bb28ee426a441f34c6196d5b92de186ff9b01357264d92de7249c859fbf4",
  "clues": 18,
  "created_at": "2026-09-19T16:53:33.101Z",
  "difficulty": {
    "band": 2,
    "max_search_depth": 0,
    "score": 54,
    "techniques": [
      "hidden_single",
      "naked_single",
      "locked_candidates_pointing",
      "naked_pair"
    ]
  },
  "family": "sudoku-classic",
  "family_version": 1,
  "generator_version": "1.0.0",
  "id": "9ec7bb28ee426a44",
  "params": {
    "band_target": 2,
    "box_h": 4,
    "box_w": 2,
    "dig_passes": 6,
    "min_clues": 14,
    "size": 8,
    "symmetry": "none"
  },
  "puzzle": "2.....463..........8.15...57.........6..5..43....18......4...8.2",
  "seed": "003|014-sudoku-classic-b2-84x2-none-50|83",
  "solution": "2831754635468217472861531657432883125674526437817183246564751832",
  "solver_version": "1.0.0",
  "uniqueness": {
    "method": "exhaustive-count-to-2",
    "nodes_searched": 9,
    "reference_checked": true,
    "verdict": "unique"
  }
}
