{
  "batch": "008",
  "canonical_hash": "cae43269742dfbddf62fdad5ece8a3f7f8c82d3fc3b1f9d6ed5c12711f4c85c8",
  "clues": 29,
  "created_at": "2026-09-19T17:48:30.912Z",
  "difficulty": {
    "band": 3,
    "max_search_depth": 0,
    "score": 68,
    "techniques": [
      "naked_single",
      "hidden_single",
      "locked_candidates_pointing",
      "hidden_triple"
    ]
  },
  "family": "sudoku-classic",
  "family_version": 1,
  "generator_version": "1.0.0",
  "id": "cae43269742dfbdd",
  "params": {
    "band_target": 3,
    "box_h": 3,
    "box_w": 3,
    "dig_passes": 6,
    "min_clues": 17,
    "size": 9,
    "symmetry": "mirror_h"
  },
  "puzzle": "...3.7.....4...2..38.....975.......89..546..1...7.8.....9...1..83.....42.764.398.",
  "seed": "008|048-sudoku-classic-b3-93x3-mirror_h-20|3206",
  "solution": "652397814794681253381254697517932468928546371463718529249875136835169742176423985",
  "solver_version": "1.0.0",
  "uniqueness": {
    "method": "exhaustive-count-to-2",
    "nodes_searched": 36,
    "reference_checked": true,
    "verdict": "unique"
  }
}
