{
  "batch": "011",
  "canonical_hash": "3e204ec80d7fca540b7e8ad1687fd2e35cb984abae33a87b2721a05516ba9701",
  "clues": 15,
  "created_at": "2026-09-19T20:22:29.755Z",
  "difficulty": {
    "band": 1,
    "max_search_depth": 0,
    "score": 21,
    "techniques": [
      "local_triples"
    ]
  },
  "family": "binairo",
  "family_version": 1,
  "generator_version": "1.0.0",
  "id": "3e204ec80d7fca54",
  "params": {
    "band_target": 1,
    "dig_passes": 6,
    "min_clues": 0,
    "size": 6,
    "symmetry": "diagonal"
  },
  "puzzle": "1..0.1.0.11......001.1...0..0.0.0..1",
  "seed": "011|096-binairo-b1-6x6-diagonal-50|16",
  "solution": "101001100110011010010101101100010011",
  "solver_version": "1.0.0",
  "uniqueness": {
    "method": "exhaustive-count-to-2",
    "nodes_searched": 1,
    "reference_checked": true,
    "verdict": "unique"
  }
}
