{
  "batch": "005",
  "canonical_hash": "17eb22d19828bdced3e0d335ccbcd820d6d4824b5937e4dc3fd142f4e93c023d",
  "clues": 6,
  "created_at": "2026-09-19T17:12:58.817Z",
  "difficulty": {
    "band": 1,
    "max_search_depth": 0,
    "score": 10,
    "techniques": [
      "naked_single"
    ]
  },
  "family": "sudoku-classic",
  "family_version": 1,
  "generator_version": "1.0.0",
  "id": "17eb22d19828bdce",
  "params": {
    "band_target": 1,
    "box_h": 2,
    "box_w": 2,
    "dig_passes": 6,
    "min_clues": 4,
    "size": 4,
    "symmetry": "diagonal"
  },
  "puzzle": ".13.4...3..1..4.",
  "seed": "005|023-sudoku-classic-b1-42x2-diagonal-50|228",
  "solution": "2134431234211243",
  "solver_version": "1.0.0",
  "uniqueness": {
    "method": "exhaustive-count-to-2",
    "nodes_searched": 2,
    "reference_checked": true,
    "verdict": "unique"
  }
}
