{
  "batch": "003",
  "canonical_hash": "8a184afef98a499672f94e84befceb2b75d127003cfd018a90f97557609f500d",
  "clues": 20,
  "created_at": "2026-09-19T16:53:34.551Z",
  "difficulty": {
    "band": 2,
    "max_search_depth": 0,
    "score": 56,
    "techniques": [
      "naked_single",
      "hidden_single",
      "locked_candidates_pointing",
      "locked_candidates_claiming"
    ]
  },
  "family": "sudoku-classic",
  "family_version": 1,
  "generator_version": "1.0.0",
  "id": "8a184afef98a4996",
  "params": {
    "band_target": 2,
    "box_h": 4,
    "box_w": 2,
    "dig_passes": 6,
    "min_clues": 14,
    "size": 8,
    "symmetry": "none"
  },
  "puzzle": "...7...3......8.1.2.....8.14..7...3.4.......67.56..1.8..2..81...",
  "seed": "003|014-sudoku-classic-b2-84x2-none-50|335",
  "solution": "5687214342567381172384568314567271354268384267156571382424681537",
  "solver_version": "1.0.0",
  "uniqueness": {
    "method": "exhaustive-count-to-2",
    "nodes_searched": 9,
    "reference_checked": true,
    "verdict": "unique"
  }
}
