{
  "batch": "004",
  "canonical_hash": "1bbe74d373be70e284c5b22df1105b0b549aaaae298dee7393e43ded390d6147",
  "clues": 25,
  "created_at": "2026-09-19T17:08:18.697Z",
  "difficulty": {
    "band": 3,
    "max_search_depth": 0,
    "score": 104,
    "techniques": [
      "hidden_single",
      "locked_candidates_pointing",
      "locked_candidates_claiming",
      "naked_single",
      "hidden_triple"
    ]
  },
  "family": "sudoku-classic",
  "family_version": 1,
  "generator_version": "1.0.0",
  "id": "1bbe74d373be70e2",
  "params": {
    "band_target": 3,
    "box_h": 3,
    "box_w": 3,
    "dig_passes": 6,
    "min_clues": 17,
    "size": 9,
    "symmetry": "none"
  },
  "puzzle": "9...1.34.2.........58...9......9.2.48....5........753.71...9..6...6.......31..7.2",
  "seed": "004|017-sudoku-classic-b3-93x3-none-20|243",
  "solution": "967218345241953867358746921536891274874325619129467538712539486485672193693184752",
  "solver_version": "1.0.0",
  "uniqueness": {
    "method": "exhaustive-count-to-2",
    "nodes_searched": 31,
    "reference_checked": true,
    "verdict": "unique"
  }
}
