{
  "batch": "007",
  "canonical_hash": "d96ab55b48769ec5888ebe38767ca731af2b42f3ee5bd9c62d05c92069e88ca3",
  "clues": 26,
  "created_at": "2026-09-19T17:39:34.463Z",
  "difficulty": {
    "band": 4,
    "max_search_depth": 0,
    "score": 115,
    "techniques": [
      "naked_single",
      "hidden_single",
      "locked_candidates_pointing",
      "hidden_pair",
      "simple_coloring"
    ]
  },
  "family": "sudoku-classic",
  "family_version": 1,
  "generator_version": "1.0.0",
  "id": "d96ab55b48769ec5",
  "params": {
    "band_target": 4,
    "box_h": 3,
    "box_w": 3,
    "dig_passes": 6,
    "min_clues": 17,
    "size": 9,
    "symmetry": "diagonal"
  },
  "puzzle": "..3..9..2.......8.9...82.3....4.......1..87.37.4.9.56.....76....65..1...8...2...1",
  "seed": "007|070-sudoku-classic-b4-93x3-diagonal-60|189",
  "solution": "583619472172345986946782135358467219691258743724193568219876354465931827837524691",
  "solver_version": "1.0.0",
  "uniqueness": {
    "method": "exhaustive-count-to-2",
    "nodes_searched": 10,
    "reference_checked": true,
    "verdict": "unique"
  }
}
