{
  "batch": "007",
  "canonical_hash": "c7a274dc984d51fbecd2ce8a4c0deb5f9d709d216d90acd4ae33f21c5db9d84d",
  "clues": 12,
  "created_at": "2026-09-19T17:40:22.464Z",
  "difficulty": {
    "band": 1,
    "max_search_depth": 0,
    "score": 24,
    "techniques": [
      "naked_single",
      "hidden_single"
    ]
  },
  "family": "sudoku-classic",
  "family_version": 1,
  "generator_version": "1.0.0",
  "id": "c7a274dc984d51fb",
  "params": {
    "band_target": 1,
    "box_h": 2,
    "box_w": 3,
    "dig_passes": 6,
    "min_clues": 8,
    "size": 6,
    "symmetry": "rot180"
  },
  "puzzle": "..3..6..6..5.6...22...4.5..3..6..5..",
  "seed": "007|083-sudoku-classic-b1-62x3-rot180-50|17",
  "solution": "453216126435364152215643542361631524",
  "solver_version": "1.0.0",
  "uniqueness": {
    "method": "exhaustive-count-to-2",
    "nodes_searched": 3,
    "reference_checked": true,
    "verdict": "unique"
  }
}
